question,answer
What business would you have with the Queen?," Gold and glory. Oh, and hate. If you've ever met my sister, you'd understand. So now that it's clear we're on the same side? (Holds out his hands expectantly. Jorah makes no move to respond). A high born knight from the North of Westeros, down on his luck in Essos. Dragon epaulettes? Bear sigil breast plate. You're Jorah Mormont. I have to ask how, exactly, were you serving your Queen in a whore house, half a world away? Is it possible, that you were running? Why would you be running? And why would she have sent you away? Oh, wait! You were spying on her, weren't you? It's all coming back to me! I was drunk through most of the Small Council meetings, but it's all coming back. You passed notes to Varys's little birds. She found out, didn't she? Found out, and exiled you. (Jorah looks downtrodden). And now you hope to win back her favor with a gift. A risky scheme. One might even say, desperate. Do you think Daenerys would execute me, and pardon you? I'd say the reverse is just as likely."
We are., What would make our time together truly enjoyable would be some wine.
No wine.," I am a person who drinks. People who drink need to keep drinking. Otherwise, they're not…"
I am., Have you sailed this route before?
No., You're going to bring Daenerys a souvenir from her ancestral homeland in case I'm not enough?
I think you'll be plenty., You know what they say. The Doom still rules Valyria. What about the demons and the flames? Aren't you afraid of the Doom?
No. But the pirates are., Oh.
And then they weren't.," And then they weren't. ""They held each other close and turned their backs upon the end. The hills that split asunder and the black that ate the skies; The flames that shot so high and hot that even dragons burned; Would never be the final sights that fell upon their eyes. A fly upon a wall, the waves the sea wind whipped and churned -"""
"""The city of a thousand years, and all that men had learned; The Doom consumed it all alike, and neither of them turned.""", I would clap.
Get behind!," Mormont, cut me free! (Jorah falls into the water). Mormont!"
You're heavier than you look. Did any of them touch you?," (Shakes his head). You? (Jorah shakes his head). I've seen greyscale before, but nothing like that."
I suppose that's why they send them there.," It'd be kinder to put daggers in their hearts and be done with it. (Jorah spits). Thank you for saving me. Of course, I wouldn't have needed saving if you hadn't kidnapped me in the first place. (Jorah gets up). So what now?"
"We walk, up the coast. With luck, we'll find a fishing village. Maybe another boat.", Without luck?
"We've got a long walk ahead of us. I'll get some wood for a fire. Try to get some rest, huh?", That's the best idea you've had all day.
I can., You’re not hungry?
Of course I’m hungry.," You’re an awful travelling companion, do you know that? Possibly the least charming man I have ever met."
I am not your travelling companion., We are travelling together. In each other’s company. Therefore…
Do you ever shut up?, I sailed from King’s Landing to Pentos in a crate. Without ever saying a word.
Why?, Never occurred to you to ask why until now? You never wondered why Tyrion Lannister decided to visit a brothel in Volantis.
I’m sure you’ve visited many brothels in many cities., I killed my father. He wanted to execute me for a crime I didn’t commit. And he was fucking the woman I loved.
What do you know about my father?," I met him. I visited the Wall. When I asked him about his men he knew all the stories, every one of them. He actually cared about the people in his command. How did they put it in the Watch? “We shall never see his like again.”"
How?, I only know what I heard
How?, He was leading an expedition beyond the wall. There was a mutiny. He was murdered by his own men.
Do you believe in anything?, I believe in many things.
"In something greater than ourselves, I mean. The Gods. Destiny. Do you believe there's a plan for this world?", No.
"Neither did I. I was a cynic, just like you. Then I saw a girl step into a great fire with three stone eggs. When the fire burned out I thought I’d find her blackened bones. Instead I found her. Daenerys. Alive and unhurt. Holding her baby dragons. Have you ever heard baby dragons singing?", No.
It's hard to be a cynic after that., Doesn’t mean she’s going to be a great queen.
No it doesn’t.," The Targaryens are famously insane. What if she conquers the world? Then what? 1,000 years of peace and prosperity?"
First we have to conquer the world.," We? Alright, let’s assume your dreams come true. She’s ecstatic when you bring her this enemy dwarf. She hacks off my head and restores your position. You command her army, sail to Westeros, defeat all your enemies, then watch as she climbs those steps and sits on the Iron Throne. Hurrah, long live the Queen. Then what?"
Then she rules., So a woman who has not spent a single day of her adult life in Westeros becomes the ruler of Westeros? That’s justice?
She is the rightful heir.," Why, because her father who burned living men for amusement was the king?"
Shh! It’s a slave ship, Why is it anchored?
It will be a dwarf-sized cock., Guess again.
"We’re bound to Volantis, not Slaver’s Bay. Besides, she reopened the fighting pits. I never heard of free men fighting in the pits."," The fighting puts in Mereen! You’re in luck then, you’re about to be rich. You are looking at one of the great warriors in the seven kingdoms."
Him? He’s got to be 60 years old.," Sure, he’s a bit long in the tooth, a bit withered, been in the sun too long. We can all see that. But he is a veteran of 100 battles. They wrote songs about him!"
Why?," We’re a team. I’m a great fighter, too."
Yes.," My Lord, if I may. I’ve heard Mereen’s become a free city. You might run into trouble if you try to fight slaves in the fighting pits. Now if you were to fight free men who were paid a wage…"
Who are you?," I am the gift. It’s a pleasure to meet you, Your Grace. My name is Tyrion Lannister."
You will not speak. How do I know you are who you say you are?, If only I were otherwise.
If you are Tyrion Lannister why shouldn’t I kill you? To pay your family back for what it did to mine, You want revenge against the Lannisters? I killed my mother Joanna Lannister the day I was born. I killed my father Tywin Lannister with a bow to the heart. I am the greatest Lannister killer of our time.
So I should welcome you into my service because you murdered members of your own family?, Into your service? Your Grace we have only just met. It’s too soon to know if you deserve my service.
If you’d rather return to the fighting pits just say the word.," When I was a young man I heard a story about a baby born during the worst storm in living memory. She had no wealth, no lands, no army, only a name and a handful of supporters, most of whom probably thought they could use that name to benefit themselves. They kept her alive, moving her from place to place, often hours ahead of the men who had been sent to kill her. She was eventually sold off to some warlord on the edge of the world and that appeared to be that. And then a few years later the most well informed person I knew told me that this girl without wealth, lands, or armies had somehow acquired all 3 in a very short span of time, along with three dragons. He thought she was our best, last chance to build a better world. I thought you were worth meeting at the very least."
And why are you worth meeting? Why should I spend my time listening to you?, Because you can not build a better world on your own. You have no one at your side who understands that land you want to rule. The strengths and the weaknesses of the houses that will either support or oppose you.
I have a very large army and very large dragons., Killing and politics aren’t always the same thing. When I served as Hand of the King I did quite well with the latter considering the king in question preferred torturing animals to leading his people. I could do an even better job advising a ruler worth the name.
So you want to advise me. Very well. (looks to Jorah) What would you have me do with him? I swore I would kill him if he ever returned., I know.
Why should the people trust a queen who can’t keep her promises?," Whomever Ser Jorah was when he started informing on you, he is no longer that man. I can’t remember seeing the same man as devoted to anything as he is to serving you. He claims he would kill for you and die for you, and nothing I have witnessed gives me reason to doubt him. And yet he did betray you."
"Yes, many opportunities.", And did he?
No. Not until forced to do so.," He worships you. He is in love with you, I think. But he did not trust you with the truth - an unpleasant truth, to be sure - but one of great significance to you. He did not trust that you would be wise enough to forgive him."
So I should kill him?," A ruler who kills those that are devoted to her is not a ruler that inspires devotion. And you’re going to need to inspire devotion, and lots of it, if you’re ever going to rule across the Narrow Sea. But you cannot have him by your side when you do."
So have you decided yet? Whether I’m worthy of your service?, Have you decided yet whether you’re going to have me killed?
It’s probably my safest option., I can see why you would think so. It’s what your father would have done.
And what would your father do?, My father? Who publicly sentenced me to death? I’d say his thoughts on having me killed were abundantly clear.
Is that why you killed him?," Some day if you decide not to execute me, I’ll tell you all about why I killed my father. And on that day, should it ever come, we’ll need more wine than this."
I know what my father was. What he did. I know the Mad King earned his name.," So here we sit, two terrible children of two terrible fathers."
I’m terrible?, I’ve heard stories.
Why did you travel to the other side of the world to meet someone terrible?, To see if you were the right kind of terrible.
Which kind is that?, The kind that prevents your people from being even more so.
I did reopen the fighting pits. Under my rule murder will once again become entertainment.," Yes, that was wise. And you agreed to marry someone you loathed for the greater good. Very impressive. My own sister married someone she loathed as well, though not by choice and certainly not for the greater good, Gods forbid. She ended up having him killed."
Perhaps it won’t come to that., It’s not impossible that Varys was right about you after all.
Varys? King Robert’s spy master?, Yes. He was the one who convinced me to come find you. He was my travelling companion before Ser Jorah seized that role for himself.
Jorah sent my secrets to Varys. For 20 years the spider oversaw the campaign to find and kill me., He did what he had to do to survive. He did a lot of other things that he didn’t have to do. I suspect he’s the main reason you weren’t slaughtered in your crib.
But you trust him?," Yes, oddly. He might be the only person in the world that I trust. Besides my brother."
The brother who killed my father., That’s the one.
Perhaps I will have you killed after all.," Your queenly prerogative. I had given up on life until Varys convinced me you might be worth living for. You chop off my head? Well, my final days were interesting."
I’m not going to kill you., No? Banish me?
No.," So if I’m not going to be murdered, and I’m not going to be banished..."
You’re going to advise me. (takes his wine cup) While you can still speak in complete sentences., Advise you on what?
How to get what I want., The Iron Throne. Perhaps you should try wanting something else.
If I want jokes I’ll get myself a proper fool., I’m not entirely joking. There’s more to the world than Westeros after all. How many hundreds of thousands of lives have you changed for the better here? Perhaps this is where you belong. Where you can do the most good.
I fought so that no child born into Slaver’s Bay would ever know what it was like to be bought or sold. I will continue that fight here and beyond. But this is not my home.," And when you get back to your home, who supports you?"
The common people.," Let’s be generous and assume that’s going to happen. Here in Slaver’s Bay you had the support of the common people and only the common people. What was that like, ruling without the rich? House Targaryen is gone, not a single person who shares your blood is alive to support you. The Starks are gone as well, our two terrible fathers saw to that. The remaining Lannisters won’t back you, not ever. Stannis Baratheon won’t back you either, his entire claim to the Throne depends on the illegitimacy of yours. That leaves the Tyrells. Not impossible, but not enough."
"Lannister, Targaryen, Baratheon, Stark, Tyrell. They’re all just spokes on a wheel. This one's on top, then that ones on top and on and on it spins, crushing the people on the ground.", It’s a beautiful dream. Stopping the wheel. You’re not the first person to have dreamt it.
"That one, the smaller man, no question, that’s where you should put your money.", The smaller man it is.
You don’t approve?, There’s always been more than enough death in the world for my taste. I can do without it in my leisure time.
"Fair enough, yet -- it’s an unpleasant question -- but what great thing has ever been accomplished without killing or cruelty?", It’s easy to confuse what is with what ought to be. Especially when what is has worked in your favor.
That is a vital part of the great city of Meereen. Which has existed long before you arrived and will remain standing long after we have returned to the dirt., My father would have liked you.
"So your reasons are true, and theirs are false. They don’t know their own minds, but you do."," Well said, you’re an eloquent man. Doesn’t mean you’re wrong. In my experience, eloquent men are right every bit as often as imbeciles."
She cannot., You can!
You walk like a rich person., You’ve spent a lot of time studying the way rich people walk?
You walk as though the paving stones were your personal property. I used to steal from people like you when I was a boy., It’s a good thing you’re not a boy anymore...because you have no cock.
Mhysa means mother in Valyrian., I know what mhysa means.
Who wrote it?, Hard to know. Our queen is not as popular in Meereen as she used to be.
The Sons of the Harpy?," Very possibly. Daenerys Targaryen took away their most valuable property, told them human beings weren’t even property to begin with. You can see why they’re unhappy. Of course, it could also be the freed men."
"The Lord of Light sent the Mother of Dragons to you, and those who love the darkness chased her away.", Many of the former slaves feel that Daenerys has abandoned them.
"How will you respond? Will you wring your hands, while you wait for the Mother of Dragons to return? Or will you you take up her flames yourselves? Will you fight for your own salvation, now that Queen Daenerys is not here to fight for you?", It’s a problem.
"The Sons of the Harpy planned their attack in the fighting pits very carefully, which means they take orders from someone.", And have you started looking for that someone?
No tears.," I know it was hard for you. You turned away a man who truly loves you because he would have been a liability in the Seven Kingdoms. That’s the kind of self-sacrifice that makes for a good ruler, if it’s any consolation."
It’s not.," No, I suppose not. I’m terrible at consoling."
"Yes, you really are."," All right, how about the fact that this is actually happening? You have your armies, you have your ships, you have your dragons. Everything you’ve ever wanted since you were old enough to want anything. It’s all yours for the taking. Are you afraid?"
Do you know what frightens me? I said farewell to a man who loves me. A man I thought I cared for. And I felt nothing. Just impatient to get on with it., He wasn’t the first to love you and he won’t be the last.
It’s your counsel I need., It’s yours. Now and always.
I do not make dwarf jokes., You think them.
"We are searching for the men who burned the ships, but nobody saw anything.", Surely there’s some good news lurking somewhere.
Astapor and Yunkai have stopped asking us for aid., Perhaps they can tell us their secret.
"The Masters have retaken both cities. Outside of Meereen, the whole of Slaver’s Bay has returned to the slavers.", What about the dragons? We have two of them here beneath the pyramid.
They are not eating. They haven’t touched any food since Queen Daenerys left.," Daenerys is the dragon queen. Can’t very well let the dragons starve, that’s obvious."
"If a dragon does not want to eat, how do you force him to eat?", Dragons do not do well in captivity.
How do you know this?, That’s what I do. I drink and I know things.
Many times., And did they ever harm you?
Never., Dragons are intelligent. More intelligent than men according to some maesters. They have affection for their friends and fury for their enemies. I am their friend.
Do they know that?, They will. It’s time they had their supper.
Patrol. When I am going on patrol with the Unsullied. What we see on patrol. Who we captured on patrol., That’s good. That’s very good.
Who said this?," Me. Just now. All right, no conversations. Let’s play a game."
My master Kraznys would sometimes make us play games.," There, that’s a start."
Only the girls.," Oh no, no, no. Not that, of course not that. Innocent games, fun games, drinking games."
We do not drink., Until you do.
The good masters of Astapor. And the wise masters of Yunkai. With help from their friends in Volantis., You see? You don’t even have to worry about the local rebellion. We only have to worry about the three rich foreign cities paying for it.
We conquered Asatapor and Yunkai once. We will do it again and execute the Masters.," If the Unsullied march off to reconquer Asatapor and Yunkai, who remain to defend the free people of Meereen?"
So we will fight them?, Possibly.
Possibly?, It’s a conversation.
You invite the enemy into our city?," I did. As a clever man once told me, “We make peace with our enemies, not our friends.”"
I don’t make peace with the queen’s enemies. I kill the queen’s enemies.," Yes, that’s the military approach. And how has that worked here in Meereen? I represent the diplomatic approach."
I bought this dwarf for a single gold honor. And somehow you’ve risen to the top of the Great Pyramid of Meereen. It’s most impressive., And now you speak for the Good Masters of Astapor.Here’s to reversals of fortune.
We came here to meet the queen and instead we’re greeted by a dwarf and a eunuch.," Let’s make this simple, shall we? Tell me what you want."
We want you to leave Slaver’s Bay. Take your dragons and your mercenaries and go., Queen Daenerys won’t stay in Meereen forever. Her path takes her westward.
You think you’re a free man now? You still follow orders. Just because your master has silver hair and tits doesn’t mean she’s not a master.," Friends, friends, friends, please."
Slavery is the way of our world., You don’t need slaves to make money. There haven’t been slaves in Westeros for hundreds of years and I grew up richer than any of you. But our queen recognizes that she erred by abolishing slavery without providing a new system to replace it. So here is the queen’s proposal. Slavery will never return to Meereen but she will give the other cities of Slaver’s Bay time to adjust to the new order.
What does that mean?," Instead of abolishing slavery overnight, we will give you seven years to end the practice."
We do not support the Sons of the Harpy.," Fine, fine, but you will cut it off all the same. I do hope you accept, my friends. You will not receive a better offer."
We speak the Common Tongue., Excellent.
You met with the slavers today., I did.
Our brothers and sister died fighting these scum. Now you invite them to our city and drink wine with them., I imagine this room was built so the rulers could intimidate the ruled.
You are a stranger here. So why do you represent Meereen in these talks with our enemies?, Because our queen chose me as her advisor. Until she returns from her travels --
When does she return?, Soon. You have my word.
We don’t know you. We don’t trust you. We know Torgo Nudho. We fight with him against the Masters. We trust him.," And that is exactly why Grey Worm took part in these negotiations. As commander of the Unsullied, he knows hot to defeat the slavers and he knows when it is time to make peace."
You have made peace with the slavers?, We offered terms.
Do not use me for your lies., Those men respect you.
They respect me because they know who I am. They know I am loyal., As do I.
"I am loyal to my queen, not you. If you betray her work, you are my enemy.", I am not betraying her work. I am trying to save her city.
You promised the slavers they could keep slavery., For a short time.
Seven years is not a short time for a slave., You’re right. Slavery is a horror that should be ended at once. War is a horror that should be ended at once. I can’t do both today.
You are wrong to trust these men., I don’t trust the Masters. I trust their self-interest. They’re trustworthy if they’re convinced that working with me is in their self-interest.
You don’t know them. You don’t understand them. We are not human in their eyes. They look at me and see a weapon. They look at her and see a whore., They look at me and they see a misshapen little beast. Their contempt is their weakness. They’ll underestimate us every time and we will use that to our advantage.
For now is the best we get in our profession., It’s not enough.
"Considering the city was on the brink of civil war, I’d say it’s a good start."," It’s not enough for Meereen to have peace. They need to know Daenerys is responsible for it. The Sons of the Harpy have a good story. Resist the foreign invaders. Our queen has an even better story. Mother of Dragons, Breaker of Chains and...all that."
The people know who brought them freedom.," Yes, but do they know who brought them security? Who brought about an end to the violence? We need someone the people trust, someone they know who cannot be bought or influenced."
Sounds like quite the hero. Where would we find him?, Who said anything about “him”?
Daenerys Stormborn is the one who was promised. From the fire she was reborn to remake the world., Yes.
She has freed the slaves from their chains and crucified the Masters for their sins., She did indeed.
"Her dragons are fire made flesh, a gift from the Lord of Light. But you heard all this before, haven’t you? On the Long Bridge of Volantis. The dragons will purify nonbelievers by the thousands, burning their sins and flesh away.", Ideally we’d avoid purifying too many nonbelievers. The Mother of Dragons has followers of many different faiths.
"You want your queen to be worshipped and obeyed. And while she’s gone, you want her advisors to be worshipped and obeyed.", I’d settle for obeyed.
I will summon my most eloquent priests. They will spread the word. Daenerys has been sent to lead the people against the darkness in this war and in the great war still to come., That sounds most excellent --
"A man named Stannis Baratheon was anointed as the chosen one by one of your priestesses. He, too, had a glorious destiny. He attacked King’s Landing and was soundly defeated by the man standing beside me. Last I had heard, he’d been defeated again, this time at Winterfell and this time for good.", We’d be most grateful for any support you could provide the queen.
"And you, an honest servant of the lord, why should I trust you to know any more than the priestess who counseled Stannis?"," My friend has a healthy skepticism of religion, but we are all loyal supporters of the queen."
Would you?, Look around. The city has come back to life.
You made a pact with fanatics., I did and it worked.
"If you shaved your beard with a straight razor, you’d say the razor worked. That doesn’t mean it won’t cut your throat.", Spoken like a man who has never had to shave.
I know., I hope you’re right about this expedition of yours.
You seem happy.," I am happy. You should both be as well. Not so long ago, this city was ready to devour itself."
I will be happy when our queen returns., Why don’t you drink? Why don’t either of you ever drink?
Unsullied never drink., Why not?
Rules., And who made these rules? Your former masters?
I have tried wine before. It made me feel funny., That’s how you know it’s working.
I do not know any jokes., Grey worm?
"The Starks and the lannisters, i thought these were enemies.", Yes.
"A joke is like a story, Torgo Nudho. Not a true story, necessarily."," A story that’s supposed to make you laugh, ideally. Not at the moment, perhaps."
I do., Tell a joke.
I am soldier all my life. You think I never hear joke?, You lied to us.
More jokes., I once walked into a brothel with a honeycomb and a jackass. The madam says- -
That changes nothing., The Unsullied could mount a defense off the beachhead. If the slavers’ forces- -
No more talking from you. Your talking gave us this., And I have acknowledged that. I’m trying- -
You’re trying to tell me what the army should do. You do not know what the army should do.," All right, what should the army do?"
"We’ll not go to the beach. If we go to the beach, the Masters will take the pyramid. The pyramid is the only place in the city we can defend. We stay here.", And then?
