question,answer
My lord.," Testifying against me wasn't a suggestion. If they can't tempt you with honey, they'll choose something less sweet."
"You've been good to me, my lord."," Pod, the trial's in a fortnight. They'll want an answer before that."
"I already gave them an answer, my lord."," I will not have you dying on my behalf. Do you hear me? If I have to take that long walk to the executioner's block, I don't want to see your head already mounted."
My lord.," Pod, I am giving you an order. Go and find my brother. Tell him I need him. And get yourself out of King's Landing before it's too late. Pod! This is farewell."
"To tell you the truth, this isn't so bad. Four walls. A pot to piss in. I was chained to a wooden post covered in my own shit for months.", Is that supposed to make me feel better?
Maybe a bit. I'm sorry I didn't come sooner.," It's complicated, yes. So how is our sister?"
How do you think? Her son died in her arms., Her son?
Don't. You know what's coming?," My trial for regicide.Yes, I know. I know the whole bloody country thinks I'm guilty. I know that one of my three judges has wished me dead more times than I can count. And that judge is my father. As for Cersei, well, she's probably working on a way to avoid a trial altogether by having me killed."
"Now that you mention it, she did ask."," So, should I turn around and close my eyes?"
Depends. Did you do it?, The Kingslayer brothers. You like it? I like it. You're really asking if I killed your son?
Are you really asking if I'd kill my brother? How can I help you?," Well, you could set me free."
You know I can't., Then there's really nothing else to say.
What do you want me to do? Kill the guards? Sneak you out of the city in the back of a cart? I'm the Lord Commander of the Kingsguard.," Sorry, I'd forgotten. I'd hate for you to do something inappropriate."
Inappropriate? You're accused of killing the king.Freeing you is treason., Except I didn't do it.
Not just yours. She's offering a knighthood to whomever finds Sansa Stark., Sansa couldn't have done this. She had more reason than anyone in the Seven Kingdoms. Do you think it's a coincidence she disappeared the same night Joffrey died?
Father's orders.," Well, we mustn't disappoint Father."
"Tyrion of the House Lannister, you stand accused by the Queen Regent of regicide. Did you kill King Joffrey?", No.
"Did your wife, the Lady Sansa?", Not that I know of.
"How would you say he died, then?", Choked on his pigeon pie.
So you would blame the bakers?, Or the pigeons. Just leave me out of it.
"Once we'd got King Joffrey safely away from the mob, the Imp rounded on him. He slapped the king across the face and called him a vicious idiot and a fool. It wasn't the first time the Imp threatened Joffrey. Right here in this throne room, he marched up those steps and called our king a halfwit. Compared His Grace to the Mad King and suggested he'd meet the same fate. And when I spoke in the king's defense, he threatened to have me killed."," Oh, why don't you tell them what Joffrey was doing?"
Silence., Pointing a loaded crossbow at Sansa Stark while you tore at her clothes and beat her.
I discovered he'd been keeping whores in the Tower of the Hand. I asked him to confine his salacious acts to the brothel where such behavior belongs. He wasn't pleased., (shakes his head)
One.," You once said that without me, this city would have faced certain defeat. You said the histories would never mention me, but you would not forget. Have you forgotten, Lord Varys?"
You're going to be found guilty.," Oh, you think so?"
Do you trust me?, (nods)
"I did everything he wanted. Whatever he told me to do to him. Whatever he felt like doing to me. I kissed him where he wanted. I licked him where he wanted. I let him put himself where he wanted. I was his property. I would wait in his chambers for hours so he could use me when he was bored. He ordered me to call him ""my lion,"" so I did. I took his face in my hands and said, ""I am yours and you are mine.""", Shae. Please don't.
Tyrion. Do you wish to confess?," Yes, Father. I'm guilty. Guilty. Is that what you want to hear?"
You admit you poisoned the king?," No, of that I'm innocent. I'm guilty of a far more monstrous crime. I am guilty of being a dwarf."
You are not on trial for being a dwarf.," Oh, yes, I am. I've been on trial for that my entire life."
Have you nothing to say in your defense?," Nothing but this-- I did not do it. I did not kill Joffrey, but I wish that I had."
"(To Cersei) Watching your vicious bastard die gave me more relief than 1,000 lying whores.", (To the crowd) I wish I was the monster you think I am. I wish I had enough poison for the whole pack of you. I would gladly give my life to watch you all swallow it.
Ser Meryn. Ser Meryn. Escort the prisoner back to his cell., I will not give my life for Joffrey's murder. And I know I'll get no justice here. So I will let the gods decide my fate. I demand a trial by combat.
I made a deal for you to keep your ungrateful head on your ungrateful neck a little while longer.," I'm sorry, what am I grateful for? The opportunity to live and die at the Wall as punishment for a crime I did not commit?"
"You threw your life away. You threw it away. It's not a joke. You understand that, don't you?"," Of course it's a joke, just not a very funny one. I couldn't- I couldn't listen to her standing there telling her lies. I couldn't do it."
You fell in love with a whore.," Yes, I fell in love with a whore. And I was stupid enough to think that she had fallen in love with me. That deal you made, it was everything Father wanted. You do see that? He gets you back as his heir. The future Lord of the Rock. And he ships me off to Castle Black, out of sight at last. All so perfect. It felt good to take that from him. He knows I'm innocent and he's willing to sacrifice me anyway. He's willing to sacrifice any of us. Not you. You're the golden son. You could kill a king, lose a hand, fuck your own sister, you'll always be the golden son."
Careful. I'm the last friend you've got., At least I got to tell them what they really are.
"Yes, brilliant speech. They'll be talking about it for days to come. I thought you were a realist. Didn't realize you'd die for pride."," Don't give up on me just yet. I survived one trial by combat, even though you weren't there to save me."
I can't save you this time either. My training has proved that I can't beat a stable boy with my left hand.," Where's your sense of adventure? Even if you lose, imagine the look on Father's face when you fall."
(laughs), Our family name snuffed out with a single swing of the sword.
It is tempting.," Well... Bronn fought for me once, he'll do it again. If he wins, I expect I'll be in his debt for the rest of my life."
If he wins., Will you find him for me? Who does Cersei plan on naming as a champion? I hope it's Ser Meryn Trant. I'd enjoy watching Bronn disembowel that pompous child beater.
My lord., You have new clothes.
Do you like 'em? Eh? Gloves are doeskin. Softer than a virgin's thighs., I sent for you days ago.
I've been a bit busy., Doing what?
My lonesome bachelor days are over. I'm to wed Lollys Stokeworth., Lollys Stokeworth? She doesn't strike me as your sort of girl.
I wouldn't say I had a single sort of girl., She's dim-witted.
"If I wanted wits, I'd marry you."," When my sister arranged this love match, did she mention that Lollys has an older sister?"
"Falyse. Aye, I did know about the older sister.", And you understand the rules of inheritance?
Falyse is forty and barren., She still gets Castle Stokeworth when her father dies.
She does. Unless she happens to perish before her father. Then Lollys gets the castle., (scoffs.)
What? Ladies fall from their horses and snap their pretty necks all the time., You and my sister deserve each other. Why did you bother to come here?
"You once said if anyone ever asked me to sell you out, you'd double their price.", Is it two wives you want or two castles?
"One of each will do. But if you want me to kill the Mountain for you, it'd better be a damn big castle.", I'm a bit short on castles at the moment. But I can offer you gold and gratitude.
I have gold. What can I buy with gratitude?, You might be surprised. A Lannister always pays his debts.
"Your sister's a Lannister, too."," My wife is heir to Winterfell. If I emerge from this with my head still on my shoulders, I may one day rule the North in her name. I could carve you out a big piece of it."
"If and may and could. It's bloody cold up north. Lollys is soft and warm. And close. If I gave you the choice between fucking Lollys and fighting the Mountain, you'd have your britches down and your cock out before I could blink.", Does he frighten you so much?
"I'd be a bloody fool if he didn't frighten me. He's freakish big and freakish strong. And quicker than you'd expect for a man of that size. Maybe I could take him, dance around until he's so tired of hacking at me, he dropped his sword, get him off his feet somehow. But one misstep... and I'm dead. Why should I risk it?", Because you're my friend.
"I like you, pampered little shit that you are. I just like myself more.", I understand.
I'm sorry it has to be this way., Why are you sorry? Because you're an evil bastard with no conscience and no heart? That's what I liked about you in the first place.
We had some good days together.," Yes, we did."
What will you do?, I suppose I'll have to kill the Mountain myself. Won't that make for a great song?
I did spend some time with an absolutely stunning blonde the other day.," Mm, do tell. I've got every kind of filth down here except the kind I like."
Your sister., Oh.
Cersei approached me. We spoke a great deal about her daughter. How worried your sister is about her. She was trying very hard to pretend she had not come to sway me against you. I think she may have even believed it herself., Making honest feelings do dishonest work is one of her many gifts.
It was difficult for her to hide her true intentions. It is rare to meet a Lannister who shares my enthusiasm for dead Lannisters. She desperately wants to see you killed., She didn't need to bother you. It looks as though I've taken care of that myself. The joy she will feel when my head leaves my neck. She's wanted this for a long time.
"Yes, I know. We met, you and I. Many years ago.", I think I would have remembered that.
"Unlikely. You had just been born. Our father brought me and my sister Elia with him on a visit to Casterly Rock. My first time away from Dorne. I didn't like anything about the Rock. Not the food, not the weather, your accents. Nothing. But the biggest disappointment... you.", You and my family have more in common than you might admit.
"The whole way from Dorne all anyone talked about was the monster that had been born to Tywin Lannister. A head twice the size of his body, a tail between his legs, claws, one red eye, the privates of both a girl and a boy.", That would have made things so much easier.
"When we met your sister, she promised she would show you to us. Every day we would ask. Every day she would say, ""Soon."" Then she and your brother took us to your nursery and... she unveiled the freak. Your head was a bit large. Your arms and legs were a bit small, but no claw. No red eye. No tail between your legs. Just a tiny pink cock. We didn't try to hide our disappointment. ""That's not a monster,"" I told Cersei. ""That's just a baby."" And she said, ""He killed my mother."" And she pinched your little cock so hard, I thought she might pull it off. Until your brother made her stop. ""It doesn't matter,"" she told us. ""Everyone says he will die soon. I hope they are right. He should not have lived this long."""," Well... sooner or later, Cersei always gets what she wants."
And what about what I want? Justice for my sister and her children.," If you want justice, you've come to the wrong place."
Soon.," Do you think Oberyn has a chance? The Red Viper of Dorne. You don't get a name like that unless you're deadly, right?"
I've never seen him fight.," Oh, he's going to die. I'm going to die."
Oberyn believes in himself., That's putting it mildly. What's the punishment for regicide? Drawing and quartering? Hanging? Breaking at the wheel?
Beheading.," Seems rather ordinary. And he was my nephew as well, so what is that? Fratricide is brothers. Filicide is sons. Nepoticide. That's the one. Matricide, patricide, infanticide, suicide. There's no kind of killing that doesn't have its own word."
Cousins.," Cousins, you're right. There is no word for cousin killing. Well done. Do you remember cousin Orson? Orson Lannister?"
Of course. Wet-nurse dropped him on his head. Left him simple., Simple? Used to sit all day in the garden. Crushing beetles with a rock.
Khuu! Khuu! Khuu!, Nothing made him happier.
Nothing made you happier. You'd think being tormented from birth would have given you some affinity for the afflicted., On the contrary. Laughing at another person's misery was the only thing that made me feel like everyone else.
"The joke wore thin, though.", For you. You drifted away.
I had other interests.," Yes, other interests. But I stayed with Orson."
Why?," I was curious. Why was he smashing all those beetles? What did he get out of it? First thing I did was ask him. ""Orson, why are you smashing all those beetles?"" He gave me an answer. ""Smash the beetles. Smash 'em. Khuu! Khuu! Khuu!"" I wasn't deterred. I was the smartest person I knew. Certainly I had the wherewithal to unravel the mysteries that lay at the heart of a moron. So I went to Maester Volarik's library."
Volarik. Tried to touch me once.," Turns out, far too much has been written about great men and not nearly enough about morons. Doesn't seem right. In any case, I found nothing that illuminated the nature of Orson's affliction or the reason behind his relentless beetle slaughter. So I went back to the source. I may not have been able to speak with Orson, but I could observe him, watch him the way men watch animals to come to a deeper understanding of their behavior. *picks up a beetle* And as I watched, I became more and more sure of it. There was something happening there. His face was like the page of a book written in a language I didn't understand. But he wasn't mindless. He had his reasons. And I became possessed with knowing what they were. I began to spend inordinate amounts of time watching him. I would eat my lunch in the garden, chewing my mutton to the music of ""khuu, khuu, khuu"". And when I wasn't watching him, I was thinking about him. Father droned on about the family legacy and I thought about Orson's beetles. I read the histories of Targaryen conquests. Did I hear dragon wings? No. I heard ""khuu, khuu, khuu"" and I still couldn't figure out why he was doing it. And I had to know, because it was horrible that all these beetles should be dying for no reason."
"Every day around the world, men, women, and children are murdered by the score. Who gives a dusty fuck about a bunch of beetles?"," I know, I know. But still, it filled me with dread. Piles and piles of them, years and years of them. How many countless living crawling things smashed and dried out and returned to the dirt? In my dreams I found myself standing on a beach made of beetle husks stretching as far as the eye could see. I woke up crying, weeping for their shattered little bodies. I tried to stop Orson once."
He was twice your size.," He just pushed me aside with a ""khuu"" and kept on smashing. Every day until that mule kicked him in the chest and killed him. *puts the beetle back on the ground* So what do you think? Why did he do it? What was it all about?"
I like to move around., You could at least wear a helmet. You shouldn't drink before a fight.
You learn this during your years in the fighting pits? I always drink before a fight., It could get you killed. It could get me killed.
Size does not matter when you are flat on your back., Thank the gods.
Apologies., I still don’t see why I had to stay in this fucking crate once we set sail.
"I saved your life. If they catch you, they catch me. I cannot say I feel overly guilty about leaving you in that “fucking crate”.", Do you know what it’s like to stuff your shit through one of those air holes?
My lord?, I don’t think I am anymore. A lord. Are you a lord if you kill your father? I don’t suppose they revoke your nobility for killing a whore. That has to be happen all the time.
You already drank yourself across the Narrow Sea., In a box. Why stop now?
There are faster ways to kill yourself., Not for a coward.
"You are many things, my friend, but not a coward.", You never told me why you set me free.
Your brother asked me to., You could have said no.
Refuse the Kingslayer? A dangerous proposition.," Not as dangerous as releasing me. You risked your life, your position, everything. Why? You’re not family, you owe me nothing."
I didn’t do it for you. I did it for the Seven Kingdoms., A drunken dwarf will never be the savior of the Seven Kingdoms.
I don’t believe in saviors. I believe men of talent have a role to play in the war to come., You’re going to have to find another soldier. I’m done with Westeros and Westeros is done with me.
"You have many admirable qualities, self-pity is not one of them. Any fool with a bit of luck can find himself born into power. But earning it for yourself, that takes work.", I’m not well-suited for work.
"I think you are. You have your father’s instinct for politics, and you have compassion.", Compassion? Yes. I killed my lover with my bare hands. I shot my own father with a crossbow.
I never said you were perfect., What is it you want exactly?
Peace. Prosperity. A land where the powerful do not prey on the powerless.," Where the castles are made of gingerbread and the moats are filled with blackberry wine. The powerful have always preyed on the powerless, that’s how they became powerful in the first place."
"Perhaps. And perhaps we’ve grown so used to horror we assume there’s no other way. If you sat on the Iron Throne, would you spread misery throughout the land?", I will never sit on the Iron Throne.
"No, you won’t. But you could help another climb those steps and take that seat. The Seven Kingdoms need someone stronger than Tommen, but gentler than Stannis. A monarch who can intimidate the high lord and inspire the people. A ruler loved by millions with a powerful army and the right family name.", Good luck finding him.
"Who said anything about him? You have a choice my friend. You can stay here at Ilyrio’s palace and drink yourself to death, or you can ride with me to Mereen, meet Daenerys Targaryen, and decide if the world is worth fighting for.", Can I drink myself to death on the road to Meereen?
(Valyrian) A bit “rusty”., (Valyrian) “Rusty” (Common Tongue) Thank you.
None of that matters now. The longer we sit here bantering the longer Daenerys is out there in the wilderness.," He’s right. The dragon headed north. If we’re going to find her, that’s where we’re to go."
We? You’re a Lannister. The Queen intends to remove your family from power., And I intend to help her do it.
You’ve been here for how many days now? I’ve fought for her for years. Since she was little more than a child., You betrayed her!
Careful now.," And she exiled you, twice, I believe?"
The second time thanks to you.," Don’t blame me for your crimes, Mormont."
"(gestures to Tyrion) He’s right. The Queen exiled Jorah. (gestures to Jorah) And he’s right, Jorah saved her life. Perhaps she feels differently about him now. Perhaps not. The only way we’ll know is if we ask her."," Fine, fine, I suppose he can join us. Just as long as he promises not to kill me in my sleep."
"Forgive me, but why would we bring you?", Pardon me?
Have you ever tracked animals in the wilderness?," Not precisely, but I have other skills that’d be very useful--"
Can you fight?, I have fought. I don’t claim to be a great warrior.
Are you good on a horse?, Middling.
So mainly you talk?, And drink. I’ve survived so far.
I thought we were so happy together until you abandoned me., I suppose there’s no point in asking how you found me.
"The birds sing in the west, the birds sing in the east. If one knows how to listen. They tell me you’ve already found favor with the Mother of Dragons."," Well, she didn’t execute me, so that’s a promising start. Now the heroes are off to find her, and I’m stuck here, trying to placate a city on the brink of civil war. Any advice for an old comrade?"
Information is the key. You need to learn your enemies’ strengths and strategies. You need to learn which of your friends are not your friends., If only I knew someone with a vast network of spies.
"Yes, best be careful. You might accidentally consume some solid food."," When I agreed to come with you, did I misrepresent my intentions? (finishes his cup of wine) Besides, what is there for me to do inside this fucking box?"
You don't like it?, I want to take a walk.
You can't. Cersei has offered a lordship to the man who brings her your head.," She ought to offer her cunt. Best part of her for the best part of me. Well, I suppose a box is as good a place for me as anywhere."
Are we really going to spend the entire road to Volantis talking about the futility of everything?, You're right. No point. (realizing) The road to Volantis? You said we were going to Meereen. What's in Volantis?
The road to Meereen., And what do you hope to find at the end of the road to Meereen?
I told you. A ruler., We've already got a ruler. Everywhere has already got a ruler. Every pile of shit on the side of every road has someone's banner hanging from it.
"You were quite good, you know. At ruling. During your brief tenure as Hand.", I didn't rule. I was a servant.
"Still, a man of talent.", Managed to kill a lot of people.
"Yes, but showed great promise in other areas as well.", She wanted me to leave King's Landing. She begged me. I wouldn't go.
Why?, 'Cause I liked it. Power. Even as a servant. (takes a drink of wine)
People follow leaders. And they will never follow us. They find us repulsive., I find us repulsive.
"And we find them repulsive, which is why we surround ourselves with large, comfortable boxes to keep them away. And yet, no matter what we do, people like you and me are never really satisfied inside the box. Not for long.", You're right. Let's go for a walk.
No., How many dwarves are there in the world? Is Cersei going to kill them all?
Volantis is a large city., I have to get out of this wheelhouse.
The likelihood of you being spotted here increases a hundredfold.," Mm, I have to get out of this wheelhouse."
I'm not sure how many new ways I can find of saying this., (Walks over to him). I will not be of any use to Daenerys Targaryen if I lose my mind. I can't remember the last face I saw that wasn't yours.
It's a perfectly good face., I'm losing my mind.
"If anyone recognizes you, you'll lose more than that."," Look, we are thousands of miles from Westeros. (Pulls his hood up). What am I? (Varys shakes his head). One more drunk dwarf."
"(Valyrian) Bought and sold, (Varys approaches Tyrion), scourged and branded...", The only red priest we had in King's Landing was Thoros of Myr. This one's much better looking.
(Valyrian) The Lord of Light hears your voice. He hears the king as he hears the slave; he hears the Stone Men in their misery..., Stone men. Good luck stopping this spread of grayscale with prayer. You'd have better luck dancing away the plague. (Varys shushes him worriedly).
(Valyrian) He has sent you a saviour! From the fire she was reborn to remake the world! The Dragon Queen!, We're going to meet the Saviour! You should have told me. Who doesn't want to meet the Saviour?
(Valyrian) It’s good luck to rub a dwarf’s head., It's even better luck to suck a dwarf's cock.
Where're you going?, I need to speak to someone with hair.
Hello., You've got no drink.
You've got no money.," Do I look like a man without money? (She looks at him incredulously). Never trust looks. Until quite recently, I was one of the richest men in the world. (She laughs). But who needs wealth when you can make a woman laugh? (Sits down). I always pay my debts, I'm well known for it."
You like her? They all like her. They all want to fuck a queen., That’s because they’ve never met a queen.
You're just saying that.," You know how to spot a liar. If I could pick any girl here, I would pick you."
Why?, Because you have a skeptical mind.
Come on.," (After a moment). I'm, I'm sorry, I can't."
Of course you can. You're shy., I'm not.
Have another drink.," Gladly, but this, I can't do. Believe me, no one is more shocked than I am. I hope it passes. What will I do in my spare time? I’ll go for a piss, that’s a start."
Your captor., Do you have wine?
No., I can't sleep without wine.
Then stay awake., You're going the wrong way. My sister's in Westeros. Westeros is west! We're heading east.
I'm not taking you to your sister., You said you were taking me to the Queen.
I am. Queen Daenerys Targaryen. She's the Queen I serve., (Chuckles). What a waste of a good kidnapping. So happens I was heading there myself!
