question,answer
Did you hear the king’s in Winterfell?, I did hear something about that.
And the queen. And her twin brother. They say that he is the most handsome man in the Seven Kingdoms., And the other brother?
The queen has two brothers?, There’s the pretty one. And there’s the clever one.
I hear they call him the Imp., I hear he hates that nickname.
Oh? I hear he’s more than earned it. I hear he’s a drunken little lecher into all manner of perversions., Clever girl.
"We’ve been expecting you, Lord Tyrion.", Have you?
M’lord.," Should I explain to you the meaning of a closed door in a whorehouse, brother?"
"You’ve much to teach me, no doubt. But our sister craves your attention."," She has odd cravings, our sister."
"A family trait. Now, the Starks are feasting us at sundown. Don’t leave me alone with these people."," I’m sorry, I’ve begun the feast a bit early. And this is the first of many courses."
You’re Tyrion Lannister. The queen’s brother?," My greatest accomplishment. You – you’re Ned Stark’s bastard, aren’t you?"
Lord Eddard Stark is my father.," And Lady Stark is not your mother. Making you a bastard. Let me give you some advice, bastard. Never forget what you are. The rest of the world will not. Wear it like armor. Then it can never be used to hurt you."
What the hell do you know about being a bastard?, All dwarves are bastards in their fathers’ eyes.
"Rough night, Imp?"," If I get through this without squirting from one end or the other, it will be a miracle."
I didn’t pick you for a hunter., The greatest in the land. My spear never misses.
They have my son., The Stark boy appears to be less green than we'd hoped.
"Both Baratheon brothers have taken up against us. Jaime captured, his armies scattered. lt's a catastrophe. Perhaps we should sue for peace.", There's your peace. Joffrey saw to that when he decided to remove Ned Stark's head. You'll have an easier time drinking from that cup than you will bringing Robb Stark to the table now. He's winning – in case you hadn't noticed.
"(shouting) They have my son! Get out, all of you. (to Tyrion) Not you. You were right about Eddard Stark. lf he were alive, we could have used him to broker a peace with Winterfell and Riverrun, which would have given us more time to deal with Robert's brothers. But now – madness. Madness and stupidity. l always thought you were a stunted fool. Perhaps l was wrong."," Half wrong. l'm new to strategy, but unless we want to be surrounded by three armies, it appears we can't stay here."
No one will stay here. Ser Gregor will head out with 500 riders and set the Riverland on fire from God's Eye to the Red Fork. The rest of us will regroup at Harrenhal. And you will go to King's Landing., And do what?
"Rule. You will serve as Hand of the King in my stead. You will bring that boy king to heel, and his mother too, if needs be. And if you get so much as a whiff of treason from any of the rest – Baelish, Varys, Pycelle…"," Heads, spikes, walls. Why not my uncle? Why not anyone? Why me?"
Hand of the King?, So it would seem.
And your father said you couldn't take anyone with you to King's Landing?," No, he said l couldn't take you with me to King's Landing. He was very specific on that point."
He knew my name?, What?
"He said, ""Don't bring Shae with you to King's Landing""?"," l believe he used the word ""whore""."
"I’m funny now? l'm Shae, the funny whore."," My father's probably the most powerful man in the country. Certainly the richest. He has all Seven Kingdoms in his pockets. Everyone everywhere always has to do exactly what my father says. He's always been a cunt. l believe the ladies of the court could learn a great deal from a girl like you. Why don't you come with me, be the Hand's lady? Because the King needs a Hand and the Hand – (Shae kisses Tyrion)"
"Better-looking bitches than you're used to, Uncle. My mother's been looking for you. We ride for King's Landing today."," Before you go, you will call on Lord and Lady Stark and offer your sympathies."
What good will my sympathies do them?, None. But it is expected of you. Your absence has already been noted.
The boy means nothing to me. And I can't stand the wailing of women., One word and I'll hit you again.
I'm telling mother!," Go! Tell her. But first you will get to Lord and Lady Stark and you will fall on your knees in front of them and tell them how very sorry you are, that you are at their service, and that all your prayers are with them. Do you understand?"
You can't..., Do you understand?
"The Prince will remember that, little lord."," I hope so. If he forgets, be a good dog and remind him. Time for breakfast..."
Little brother., Beloved siblings.
Is Bran going to die?, Apparently not.
What do you mean?, The Maester says the boy may live.
"It's no mercy, letting a child linger in such pain.", Only the gods know for certain. All the rest of us can do is pray. The charms of the north seem entirely lost on you.
I still can't believe you're going. It's ridiculous even for you.," Where's your sense of wonder? The greatest structure ever built, the intrepid men of the Night's Watch, the wintry abode of the White Walkers."
Tell me you're not thinking of taking the black., And go celibate? The whores would go begging from Dorne to Casterly Rock. I just want to stand on top of the Wall and piss off the edge of the world.
"Even if the boy lives, he'll be a cripple, a grotesque. Give me a good clean death any day."," Speaking for the grotesques, I'd have to disagree. Death is so final, whereas life... Life is full of possibilities. I hope the boy does wake. I'd be very interested to hear what he has to say."
"My dear brother, there are times you make me wonder whose side you're on."," My dear brother, you wound me. You know how much I love my family."
Sit. You'll be fed. Untie them., Rapers. They were given a choice no doubt... Castration or the Wall. Most choose the knife. Not impressed by your new brothers? Lovely thing about the Watch... You discard your old family and get a whole new one.
Why do you read so much?, Look at me and tell me what you see.
Is this a trick?," What you see is a dwarf. If I'd been born a peasant they might've left me out in the woods to die. Alas, I was born a Lannister of Casterly Rock. Things are expected of me. My father was the Hand of the King for 20 years."
Until your brother killed that King.," Yes, until my brother killed him. Life is full of these little ironies. My sister married the new King and my repulsive nephew will be King after him. I must do my part for the honor of my house, wouldn't you agree? But how? Well, my brother has his sword and I have my mind. And a mind needs books like a sword needs a whetstone. That's why I read so much. And you? What's your story, bastard?"
"Ask me nicely and maybe I'll tell you, dwarf."," A bastard boy with nothing to inherit, off to join the ancient order of the Night's Watch, alongside his valiant brothers-in-arms."
The Night's Watch protects the realm from...," Yes yes, against grumpkins and snarks and all the other monsters your wet nurse warned you about. You're a smart boy. You don't believe that nonsense... Everything's better with some wine in the belly."
I don't need him to be charming. I need him to turn this bunch of thieves and runaways into men of the Night's Watch.," And how's that going, Commander Mormont?"
Slowly. A raven came for Ned Stark's son., Good news or bad?
"What're you looking at, halfman?", I'm looking at you. You've got an interesting face. Very distinctive faces. All of you.
What do you care about our faces?," It's just I think they would look marvelous decorating spikes in King's Landing. Perhaps I'll write my sister, the Queen, about it."
Everybody knew what this place was and no one told me. No one but you. My father knew and left me to rot here at the Wall all the same., Grenn's father left him too... Outside a farmhouse when he was three. Pyp was caught stealing a wheel of cheese. His little sister hadn't eaten in three days. He was given a choice: his right hand or the Wall. I've been asking the Lord Commander about them. Fascinating stories.
They hate me because I'm better than they are., It's a lucky thing none of them were trained by a master-at-arms like your Ser Rodrik. I don't imagine any of them have ever held a real sword before they came here. Your brother Bran. He's woken up.
A bear's balls., You're joking?
"And his brains and his guts, his lungs and his heart all fried in his own fat. When you're a hundred miles north of the Wall and you ate your last meal a week ago, you leave nothing for the wolves.", And how do a bear's balls taste?
"A bit chewy. And what about you, my Lord? What's the strangest thing you've eaten?"," Do Dornish girls count? So you roam the Seven Kingdoms, collaring pickpockets and horse thieves and bringing them here as eager recruits?"
But it's not all of 'em's done bad things. Some of 'em's just poor lads looking for steady feed. Some of 'em's high-born lads looking for glory., They have a better chance finding feed than glory.
"The Night's Watch is a joke to you, is it? Is that what we are, Lannister? An army of jesters in black?"," You don't have enough men to be an army and aside from Yoren here, none of you are particularly funny."
"I hope we've provided you with some good stories to tell when you're back in King's Landing. But something to think about while you're drinking your wine down there, enjoying your brothels... Half the boys you've seen training will die north of the Wall. Might be a wilding's axe that gets them, might be sickness, might just be the cold. They die in pain. And they do it so plump little lords like you can enjoy their summer afternoons in peace and comfort."," Do you think I'm plump? Listen, Benjen... May I call you Benjen?"
Call me what you like., I'm not sure what I've done to offend you. I have great admiration for the Night's Watch. I've great admiration for you as First Ranger.
"You know, my brother once told me that nothing someone says before the word ""but"" really counts."," But... I don't believe that giants and ghouls and White Walkers are lurking beyond the Wall. I believe that the only difference between us and the wildlings is that when the Wall went up, our ancestors happened to live on the right side of it."
I always do.," I think he's starting to like me. ""Going below""?"
Into the tunnel and out the other side. He'll be north of the Wall for a month or two., So you're heading down to King's Landing too.
Day after tomorrow. I get about half of my recruits from their dungeons., Let's share the road. I could use some decent company.
"I travel a bit on the grubby side, my Lord.", Not this time. We'll be staying at the finest castles and inns. No one turns away a Lannister.
"How many winters have you seen, Lord Tyrion?"," Eight... no, nine."
All of them brief?," They say the winter of my birth was three years long, Maester Aemon."
"We've been capturing wildlings, more every month. They're fleeing south. The ones who flee... say they've seen the White Walkers."," Yes, and the fishermen of Lannisport say they see mermaids."
"I'm sorry to see you leave, Lannister.", It's either me or this cold. And it doesn't appear to be going anywhere.
Will you stop at Winterfell on your way South?, I expect I will. Gods know there aren't many feather beds between here and King's Landing.
"If you see my brother Bran, tell him I miss him. Tell him I'd visit if I could.", Of course.
He'll never walk again.," If you're going to be a cripple, it's better to be a rich cripple. Take care, Snow."
Any man of the Night's Watch is welcome at Winterfell.," Any man of the Night's Watch, but not I, eh, boy?"
"I'm not your boy, Lannister. I'm Lord of Winterfell while my father is away.", Then you might learn a lord's courtesy.
He has no memory of that day., Curious.
Why are you here?, Would your charming companion be so kind as to kneel? My neck is beginning to hurt.
"Kneel, Hodor."," Do you like to ride, Bran?"
The boy has lost the use of his legs.," What of it? With the right horse and saddle, even a cripple can ride."
I'm not a cripple., Then I'm not a dwarf. My father will rejoice to hear it. I have a gift for you. Give that to your saddler. He'll provide the rest. You must shape the horse to the rider. Start with a yearling and teach it to respond to the reins and to the boy's voice.
Will I really be able to ride?,You will. On horseback you will be as tall as any of them.
Is this some kind of trick? Why do you want to help him?," I have a tender spot in my heart for cripples, bastards and broken things."
You've done my brother a kindness. The hospitality of Winterfell is yours.," Spare me your false courtesies, Lord Stark. There's a brothel outside your walls. There I'll find a bed and both of us can sleep easier."
"Couldn't resist some northern ass? If you like redheads, ask for Ros."," Come to see me off, Greyjoy? Kind of you. Your master doesn't seem to like Lannisters."
He's not my master.," No, of course not. What happened here? Where is lady Stark? Why didn't she receive me?"
She wasn't feeling well.," She's not in Winterfell, is she? Where did she go?"
My lady's whereabouts...," My lady? Your loyalty to your captors is touching. Tell me, how do you think Balon Greyjoy would feel if he could see his only surviving son has turned lackey? I still remember seeing my father's fleet burn in Lannisport. I believe your uncles were responsible?"
Must have been a pretty sight.," Nothing prettier than watching sailors burn alive. Yes, a great victory for your people. Shame how it all turned out."
We were outnumbered 10 to one.," A stupid rebellion then. I suppose your father realized that when your brothers died in battle. Now here you are, your enemy's squire."
"Careful, Imp."," I've offended you. Forgive me, it's been a rough morning. Anyway, don't despair. I'm a constant disappointment to my own father and I've learned to live with it. Your next tumble with Ros is on me. I'll try not to wear her out."
"I'm sorry, my Lord, we're full up. Every room."," My men can sleep in the stable. As for myself, I don't require a large room."
"Truly, my lord, we have nothing.", Is there nothing I can do... to remedy this?
You can have my room.," There's a clever man. You can manage food, I trust? Yoren, dine with me."
My Lord of Lannister! Might I entertain you while you eat? I can sing of your father's victory at King's Landing!, Nothing would more likely ruin my supper. Lady Stark! What an unexpected pleasure. I was sorry to have missed you at Winterfell.
Our lord is honored by his trust.," I envy your father all his fine friends, but I don't quite see the purpose of this."
"On that eve, the captive Imp down-wards from his horse did limp, no more would he preen and primp, in garb of red and gold. (singing)", This isn't the Kingsroad. You said we were riding for Winterfell.
I did... often and loudly.," Very wise. They'll be out in droves, looking for me in the wrong place. Word's probably gotten to my father by now. He'll be offering a handsome reward. Everyone knows a Lannister always pays his debts. Would you be so good as to untie me?"
And why would I do that?, Why not? Am I going to run? The hill tribes would kill me for my boots. Unless a Shadowcat ate me first.
Shadowcats and hill tribes are the least of your concerns.," Ah... the Eastern Road. We're going to The Vale. You're taking me to your sister's to answer for my imagined crimes. Tell me, Lady Stark. When was the last time you saw your sister?"
Five years ago.," She's changed. She was always a bit touched, but now... you might as well kill me here."
"I am not a murderer, Lannister.", Neither am I! I had nothing to do with the attempt on your son's life!
The dagger found, What sort of imbecile arms an assassin with his own blade?
Should I gag him?, Why? Am I starting to make sense?
Your first? You need a woman. Nothing like a woman after a fight.," Well, I'm willing if she is."
Give me 10 good men and some climbing spikes... I'll impregnate the bitch., I like you.
He's Tyrion the Imp of House Lannister. He killed your father. He murdered the Hand of the King!, Oh? Did I kill him too? I've been a very busy man.
You will watch your tongue! These men are Knights of the Vale. Every one of the loved Jon Arryn. Every one of them would die for me.," If any harm comes to me, my brother, Jaime, will see that they do."
Dwarf man making noise!, How would you like to be rich?
Dwarf man still making noise.," My family is rich. We have gold, lots of gold. I’m prepared to give you lots of gold."
No gold!," Well, I don’t have it here."
Noise again!, About the gold -
No gold!," Listen to me! Listen to me! Sometimes possession… is an abstract concept. When they captured me they took my purse, but the gold is still mine."
Where?," Where? I don’t know where, but when they free me -"
You want free? Go be free. (points out of the skycell)," Have you ever heard the phrase “Rich as a Lannister”? Of course you have. You’re a smart man. You know who the Lannisters are. I am a Lannister. Tyrion, son of Tywin! And of course, you have also heard the phrase, “a Lannister always pays his debts.” If you deliver a message from me to Lady Arryn, I will be in your debt. I will owe you gold. If you deliver the message and I live, which I very much intend to do."
What message?, Tell her I wish to confess my crimes.
You wish to confess your crimes?," Yes, my lady. I do, my lady."
"Skycells always break them. Speak, Imp. Meet your gods as an honest man."," Where do I begin, my lords and ladies? I’m a vile man, I confess it. My crimes and sins are beyond counting. I have lied and cheated, gambled and whored. I’m not particularly good at violence, but I’m good at convincing others to do violence for me. You want specifics, I suppose. When I was seven, I saw a servant girl bathing in the river. I stole her robe. She was forced to return to the castle, naked and in tears. I close my eyes, I can still see her tits bouncing. When I was ten, I stuffed my uncle’s boots with goatshit. When confronted with my crime, I blamed a squire. Poor boy was flogged and… I escaped justice. When I was twelve, I milked my eel into a pot of turtle stew. I flogged the one-eyed snake. I skinned my sausage. I made the bald man cry into the turtle stew, which I do believe my sister ate. At least I hope she did. I once brought a jackass and a honeycomb into a brothel -"
What do you think you’re doing?, Confessing my crimes.
"Lord Tyrion, you are accused of hiring a man to slay my son Bran in his bed, and of conspiring to murder my sister’s husband; Lord Jon Arryn, the Hand of the King."," Oh, I’m very sorry. I don’t know anything about all that."
"You’ve had your little joke. I trust you enjoyed it. Mord, take him back to the dungeon. But this time find a smaller cell, with a steeper floor."," Is this how justice is done in the Vale? you accuse me of crimes, I deny them, so you throw me in a cell to freeze and starve? Where is the King’s Justice? I’m accused and demand a trial."
"If you’re tried and found guilty, then by the king’s own laws you will pay with your life.", I understand the law.
"You want a trial, my Lord Lannister. Very well. My son will listen to whatever you have to say, and you will hear his judgement. Then you will leave, by one door or the other.", No need to bother Lord Robin. I demand a trial by combat.
"With all my heart, my Lady. But the Imp is half my size. It would be shameful to slaughter such a man and call it justice.", Agreed.
You demanded a trial by combat.," Now I demand a champion. I have that right, same as you."
"My Lady, I would gladly fight the Imp’s champion for you."," I wouldn’t be too glad, ser. I name my brother, Jaime Lannister."
The Kingslayer is hundreds of miles from here.," Send a raven for him, I’m happy to wait."
The trial will be today., Do I have a volunteer?
Can I make the little man fly now?, Not this little man. This little man is going home. I believe you have something of mine.
Will you shut up? There's hill tribes all around here.," If I'm going to die, it may as well be with a song in my heart."
"You don't think I'd do it, do you?"," What do you want, Bronn? Gold? Women? Golden women?"
Tyrion. Tyrion. Tyrion.," Come, share our fire."
"When you meet your Gods, you tell them Shagga Son of Dolf of the Stone Crows sent you.", I am Tyrion son of Tywin of Clan Lannister.
We have no use for a half man's promises.," Half a man maybe, but at least I have the courage to face my enemies."
You think you can win us over with your trinkets?, That trinket is worth more than everything your tribe owns.
"What is ""this""?", The Vale of Arryn.
The rumors of your demise were unfounded., Sorry to disappoint you.
You wouldn't know him.," May I present My Lord Father, Tywin son of Tytos of House Lannister."
"Jaime smashed the River Lords at the Golden Tooth, and now lays siege to Riverrun, Catelyn Stark's homeland.", And the Starks? Lord Eddard?
"The boy may lack experience and sense, but he does have a certain mindless provincial courage."," Oh, do continue. Didn't mean to interrupt."
"The great hairy one insisted he must have two battleaxes. Heavy black steel, double-sided.", Shagga likes axes.
"When the battle commences, you and your wildlings will be in the vanguard.", The vanguard? Me and the tribesmen on the front lines?
They do seem rather ferocious.," Ferocious? Last night a Moon Brother stabbed a Stone Crow over a sausage. Three Stone Crows seized the Moon Brother and opened his throat. Bronn managed to keep Shagga from chopping off the dead man's cock, which was fortunate, but even still, Ulf is demanding blood money, which Shagga and Gunthor refuse to pay."
"When soldiers lack discipline, the fault lies with their commander.", Surely there are ways to have me killed that would be less detrimental to the war effort.
There'll be no more discussion on the matter.," lt appears l'm not hungry after all. Excuse me, my lords."
l took her., Took her? From whom?
"From, uh, Ser What's-his-name? l don't know. Ginger cunt, three tents down.", And he didn't have anything to say about it?
He said something.," Well, the odds of me living long enough for him to retaliate have just dropped drastically. We'll be at the vanguard tomorrow."
Who would you like me to be?, What did your mother call you?
Shae. What did your mother call you?, My mother died giving birth to me.
ls that why l'm here? So we can talk about our mothers?, What sort of accent is that?
Foreign., For-
What do you want from me?," What do l want from you? l want you to share my tent. l want you to pour my wine, laugh at my jokes, rub my legs when they're sore after a day's ride. l want you to take no other man to bed for as long as we're together. And l want you to fuck me like it's my last night in this world. Which it may well be."
And what do l get?," One - safety. No one will hurt you for as long as you're mine. Two - the pleasure of my company, which l have heard is spectacular."
Who told you this? Women you paid?, And three - more gold than you can spend if you lived a thousand years. Do you accept my proposal?
"Are you in agony, my lion?", No.
You look like you're in agony. The fire is burning your pretty soft skin.," Ah! Damn you, woman. Are you immune to pain?"
Drink., Let's play a new game.
There's a Braavosi knife game l could teach you., Does it involve the potential for losing fingers?
Not if you win.," No! No fire games, no knife games. Let's do something l'm good at."
What are you good at?, l happen to be a great judge of character.
This sounds like a boring game.," lt's not. Here's how it works - l make a statement about your past. lf l'm right, you drink. lf l'm wrong, l drink. And no lying. l'll know if you're lying."
l don't want to play this game., Fine. Bronn first. Your father beat you.
But my mother hit harder., You killed your first man before you were 12.
"lt was a woman. (Tyrion drinks. Shae looks at Bronn, surprised.) She swung an axe at me.", You've been north of the Wall.
Work.," And you once loved a woman many years ago, but it turned out badly so you've never let yourself love again. Oh, wait, that's me. (Tyrion drinks) Your turn, my mysterious foreign beauty."
l don't want to play., lt's fun! Look at the fun we're having. Your mother was a whore.
Drink., And we've established the rules about lying?
The whole shit-stained world could drink off that one.," So, specifics… You wanted to be elsewhere, but how would you get there? l don't believe the life of the Silent Sisters is for you. So, what's a lowborn girl to do?"
Drink., Are you sure –
"Drink! And don't talk about my mother and father ever, or l will carve your eyes from your head."," My dear lady, if l have offended you, l apologize."
My turn.," Fine, fine. Ask away. Try to penetrate the enigma that is me."
Who were you in love with?, That's not how the game works.
Married?, How did you hear that?
You hear lots of things playing dice with Lannister soldiers.," Another night, perhaps."
Not another night. This night., lt's not a pleasant story.
